{
  "$schema": "../../schemas/install-manifest.schema.json",
  "manifestVersion": "1",
  "suiteVersion": "0.1.0-pre",
  "schemaVersion": 1,
  "installedAt": "1970-01-01T00:00:00.000Z",
  "target": "/PLACEHOLDER/TARGET/PATH",
  "adapters": ["generic"],
  "files": [
    {
      "path": ".testatlas/PLACEHOLDER.md",
      "source": ".testatlas/PLACEHOLDER.md",
      "type": "suite",
      "hash": "0000000000000000"
    }
  ]
}
